{
  "id": "default",
  "name": "Lovely Cat",
  "scale": 1.0,
  "anchor": "bottom-right",
  "defaultState": "idle",
  "states": {
    "idle": {
      "fps": 12,
      "loop": true,
      "frames": [
        "frames/idle/0001.png"
      ]
    },
    "hover": {
      "fps": 16,
      "loop": true,
      "frames": [
        "frames/hover/0001.png"
      ]
    },
    "tap": {
      "fps": 18,
      "loop": false,
      "frames": [
        "frames/tap/0001.png"
      ],
      "nextState": "idle"
    }
  }
}
